{
  "case_id": "case-demo-0001",
  "tenant_id": "tenant-demo-bfsi-01",
  "title": "Suspicious PowerShell execution chain on demo-host-17",
  "status": "closed",
  "severity": "high",
  "owner_id": "user-demo-analyst-02",
  "linked_alert_ids": ["env-demo-0001"],
  "evidence_ids": ["soc-evid-demo-0001"],
  "task_ids": ["task-demo-0001"],
  "agent_run_ids": ["run-demo-0001"],
  "sla": { "due_at": "2026-08-20T07:14:00Z", "status": "on_track" },
  "created_at": "2026-08-20T03:16:00Z",
  "closed_at": "2026-08-20T05:40:00Z",
  "closure": {
    "classification": "true_positive",
    "reason": "Confirmed encoded-command execution consistent with initial-access tooling; host isolated (dry-run) and account credential reset recommended.",
    "closed_by": "user-demo-analyst-02"
  }
}
